,Topic,Count,Name,Representation,Representative_Docs
0,-1,17,-1_gitlab_false_drop_build,"['gitlab', 'false', 'drop', 'build', 'https', 'google', 'ci', 'template', 'png', 'files']","[""Hi everyone,\n\nI've encountered some unexpected behavior in my GitLab instance and wanted to check if anyone has experienced something similar.\n\nLooking at my PostgreSQL logs, I noticed a sequence of DROP TABLE commands targeting various tables (e.g., ci\\_runners\\_e59bb2812d, sprints, ai\\_conversation\\_threads, etc.), followed by an attempt to DROP DATABASE gitlabhq\\_production. Here’s a snippet from the logs:\n\n2025-02-13 17:27:45.800 UTC \\[60997\\] postgres@gitlabhq\\_production LOG:  statement: DROP TABLE IF EXISTS ci\\_runners\\_e59bb2812d CASCADE;\n\n2025-02-13 17:27:45.953 UTC \\[60997\\] postgres@gitlabhq\\_production LOG:  statement: DROP TABLE IF EXISTS sprints CASCADE;\n\n...\n\n2025-02-13 17:27:47.085 UTC \\[61024\\] postgres@postgres LOG:  statement: DROP DATABASE gitlabhq\\_production;\n\n2025-02-13 17:27:47.345 UTC \\[61024\\] postgres@postgres LOG:  AUDIT: SESSION,1,1,DDL,DROP DATABASE,,,DROP DATABASE gitlabhq\\_production;,<not logged>\n\nIt looks like something attempted to drop the entire GitLab database. Fortunately, the DROP DATABASE postgres; command failed due to it being in use.\n\nMy Questions:\n\nIs this expected behavior? Could this be part of a GitLab cleanup or maintenance process?\n\nHas anyone seen similar logs? Could this be due to an automatic migration, or does it suggest an external issue?\n\nAny recommendations on where to investigate further?\n\nI’d appreciate any insights or experiences you can share. Thanks in advance!"", ""Hey everyone,\n\nI'm looking for a reliable tool that can detect Personally Identifiable Information (PII)—such as names, phone numbers, bank account details—and other sensitive data in both code repositories and images within GitLab.\n\nIdeally, the tool should:\n\nIntegrate with GitLab CI/CD for automated scanning\n\nSupport SAST .gitlab-ci.yml, SARIF files, or any other format to view detailed reports\n\nDetect PII and SPI across code, commits, and Git history\n\nI’m aware of GitLab’s SAST capabilities, but I haven't seen any options to add custom regex-based rulesets for PII/SPI detection.\n\nI’ve come across TruffleHog and GitLeaks, but I’d love to hear about any other recommendations, especially tools that generate detailed, viewable reports in GitLab.\n\nHas anyone implemented a similar solution for GitLab reporting in their workflow? Any insights or best practices would be greatly appreciated."", 'On Gitlab, I want it so that my markdown files and other files of different types count as different languages on the summary page of my repo.\n\n[The current language bar looks like this for me](https://preview.redd.it/3wefgcsxonfe1.png?width=349&format=png&auto=webp&s=563e0d644e22efd9fa7056d6ef075ac2b7a0aa08)\n\nBut then I have my gitattributes filled out to recognize these other file types\n\n[.gitattributes](https://preview.redd.it/la8fkt13pnfe1.png?width=1310&format=png&auto=webp&s=95c9b5ea52bd11662f227afcb29ce6c38483cefb)\n\n    # Please show these langauges in stats\n    *.txt linguist-detectable=true linguist-language=Text linguist-documentation=false linguist-generated=false linguist-vendored=false\n    *.cbp linguist-detectable=true linguist-language=XML linguist-documentation=false linguist-generated=false linguist-vendored=false\n    *.md linguist-detectable=true linguist-language=Markdown linguist-documentation=false linguist-generated=false linguist-vendored=false\n    *.yml linguist-detectable=true linguist-language=YAML linguist-documentation=false linguist-generated=false linguist-vendored=false\n\nHere are the files that I have in my project, so I think it should be recognizing my .cbp and my text files and readme\n\n[Files in my project](https://preview.redd.it/6noxu1mdpnfe1.png?width=242&format=png&auto=webp&s=f7e767cef909756f40290aa4ad643ce06938b95f)\n\nAny help would be appreciated']"
1,0,41,0_gitlab_2025_utc_20,"['gitlab', '2025', 'utc', '20', '13', '11', 'com', '57', 'https', 'gitlab com']","['New year, new activities! Hello, GitLab Community! 👋\n\nCheck out the list of trends (and threats) in data protection! Enter 2025 safely!\n\n# 📚 News & Resources\n\n**Blog Post 📝| GitLab 17.7 Release** GitLab 17.7 release introduces over 230 improvements. These include: a new Planner user role, auto-resolution policy for vulnerabilities, admin-controlled instance integration allowlists, access token rotation in the UI, and much more! GitLab expressed their gratitude towards the community for 138 contributions. 👉 [Find out more](https://about.gitlab.com/releases/2024/12/19/gitlab-17-7-released/)\xa0\n\n**Blog Post 📝| Data Protection And Backup Predictions For 2025 and beyond** Gartner predicts that by 2028, roughly 75% of organizations will be relying on SaaS applications for backup. Not a surprising statistic when we consider the rising cyber threats and more rigorous regulations. This article provides an overview of data protection trends predicted for 2025 and beyond! 👉 [Full article](https://gitprotect.io/blog/data-protection-and-backup-predictions-for-2025-and-beyond/)\n\n\xa0**Blog Post 📝| Automating with GitLab Duo, Part 3: Validating testing** This article outlines the tests that the author ran while trying to validate the impact of GitLab Duo on their team’s automated testing. The results gathered from this are discussed and show what has been achieved so far. 👉 [More details](https://about.gitlab.com/blog/2024/12/17/automating-with-gitlab-duo-part-3-validating-testing/)\xa0\n\n\xa0**Blog Post 📝| Transform code quality and compliance with automated processes** As you may know, manual code review may not be enough for DevSecOps-focused teams. GitLab outlines its premium features that address the technical debt and security vulnerability challenges of some of the traditional approaches. Learn more about compliance controls, review systems, and software security. 👉 [Read more](https://about.gitlab.com/blog/2024/12/13/transform-code-quality-and-compliance-with-automated-processes/)\xa0\xa0\n\n**Blog Post 📝| Best Practices for Securing Git LFS on GitHub, GitLab, Bitbucket, and Azure DevOps** As you may know, Git Large File Storage (LFS) is an open-source extension for Git, which can be used to handle versioning of larger files. It makes it easier for a developer to manage data since repositories are optimized - data is stored separately from the repo’s structure. It is also better to know how to protect this data well. 👉 [More details](https://gitprotect.io/blog/best-practices-for-securing-git-lfs-on-github-gitlab-bitbucket-and-azure-devops/)\n\n# 📅 Upcoming Events\xa0\n\n**Webcast 🪐 | Transitioning from AWS CodeCommit to GitLab | Jan 23, 2025 | 3 pm GMT | Virtual** This webcast will cover topics from why organizations transition to GitLab, what benefits GitLab brings for DevSecOps and how to ensure a smooth transition. Since AWS CodeCommit has been deprecated, it’s good to guarantee a smooth migration, while keeping your development work, integrations, and processes secure. Check out expert opinions and best practices for a seamless migration! 👉 [Save your spot](https://page.gitlab.com/webcasts-january23-transitioning-aws-codecommit-to-gitlab.html)\n\n\xa0**Online Event 🪐| GitLab Hackathon | Jan 23 - Jan 30, 2025 | Virtual** GitLab’s Hackathon is a great opportunity for devs interested in contributing code, translations, UX designs, and more to GitLab. Not only do you get to participate in things of interest to you, but you can actually improve your skills and knowledge over the 7-day hackathon! There will be prizes for participants and their merge requests. 👉 [Take part](https://about.gitlab.com/community/hackathon/)\n\n\xa0**Online Workshop 🪐| AI in DevSecOps: Hands-on Workshop | Jan 30, 2025 | 2 pm - 5pm CET** This workshop will revolve around AI use in DevSecOps. Check out how a DevSecOps platform with AI can benefit you. It can improve your workflows, beyond code creation - actually streamline the entire software development lifecycle! 👉 [Secure your spot](https://page.gitlab.com/workshop_January30_DuoAIWorkshop_EMEA.html)\xa0\n\n✍️ *Subscribe to* [*GitProtect DevSecOps X-Ray Newsletter*](https://gitprotect.io/gitprotect-newsletter.html?utm_source=sm&utm_medium=ac) *and always stay tuned for more news!*', '🎉The **GitLab Hackathon** is now open!🚀  \nWe\'re excited to kick off another week of collaboration and innovation! Checkout our kickoff video [here](https://youtube.com/shorts/pAnjq3Xt7J4) and make sure to follow your progress on the hackathon [leaderboard](https://gitlab-community.gitlab.io/community-projects/merge-request-leaderboard/?&createdAfter=2025-01-23&createdBefore=2025-01-30&mergedBefore=2025-03-02&label=Hackathon).\n\n**Ready to contribute?**  \nContributions to all projects under the [gitlab-org](https://gitlab.com/gitlab-org) and [gitlab-com](https://gitlab.com/gitlab-com) groups qualify for the Hackathon. Additionally, contributions to [GitLab Components](https://gitlab.com/components) qualify.\n\n**Not sure what to work on**?\n\n* Checkout the #contribution\\_opportunities channel on Discord\n* Our teams have curated lists of issues ready for you to tackle:\n   * [gitlab-org/gitlab#510132](https://gitlab.com/gitlab-org/gitlab/-/issues/510132)(some issues qualify for bonuses points!)\n   * [gitlab-org/gitlab#513333](https://gitlab.com/gitlab-org/gitlab/-/issues/513333)\n\n**Need help**?  \nReach out to #contribute or ask for help from our [merge request coaches](https://docs.gitlab.com/ee/development/contributing/merge_request_coaches.html) using ""@gitlab-bot help"" in an issue or MR.\n\n**Want to know more?**  \nVisit the hackathon [page](https://about.gitlab.com/community/hackathon/).\n\n**Remember: MRs must be merged within 30 days to qualify.**', ""I try to create backups of my self-hosted GitLab (running in Docker container) with `sudo docker exec -t gitlab gitlab-backup create`. However, when i check `backups` the directory is still empty. Im grateful about any ideas what i'm missing!\n\n\n\nThis is the output:\n\n    2025-01-13 20:11:52 UTC -- Dumping database ...\n    2025-01-13 20:11:52 UTC -- Dumping PostgreSQL database gitlabhq_production ...\n    2025-01-13 20:11:56 UTC -- [DONE]\n    2025-01-13 20:11:56 UTC -- Dumping database ... done\n    2025-01-13 20:11:56 UTC -- Dumping repositories ...\n    ...\n    2025-01-13 20:11:57 UTC -- Dumping repositories ... done\n    2025-01-13 20:11:57 UTC -- Dumping uploads ...\n    2025-01-13 20:11:57 UTC -- Dumping uploads ... done\n    2025-01-13 20:11:57 UTC -- Dumping builds ...\n    2025-01-13 20:11:57 UTC -- Dumping builds ... done\n    2025-01-13 20:11:57 UTC -- Dumping artifacts ...\n    2025-01-13 20:11:57 UTC -- Dumping artifacts ... done\n    2025-01-13 20:11:57 UTC -- Dumping pages ...\n    2025-01-13 20:11:57 UTC -- Dumping pages ... done\n    2025-01-13 20:11:57 UTC -- Dumping lfs objects ...\n    2025-01-13 20:11:57 UTC -- Dumping lfs objects ... done\n    2025-01-13 20:11:57 UTC -- Dumping terraform states ...\n    2025-01-13 20:11:57 UTC -- Dumping terraform states ... done\n    2025-01-13 20:11:57 UTC -- Dumping container registry images ... [DISABLED]\n    2025-01-13 20:11:57 UTC -- Dumping packages ...\n    2025-01-13 20:11:57 UTC -- Dumping packages ... done\n    2025-01-13 20:11:57 UTC -- Dumping ci secure files ...\n    2025-01-13 20:11:57 UTC -- Dumping ci secure files ... done\n    2025-01-13 20:11:57 UTC -- Dumping external diffs ...\n    2025-01-13 20:11:57 UTC -- Dumping external diffs ... done\n    2025-01-13 20:11:57 UTC -- Creating backup archive: 1736799112_2025_01_13_17.7.1_gitlab_backup.tar ...\n    2025-01-13 20:11:57 UTC -- Creating backup archive: 1736799112_2025_01_13_17.7.1_gitlab_backup.tar ... done\n    2025-01-13 20:11:57 UTC -- Uploading backup archive to remote storage  ... [SKIPPED]\n    2025-01-13 20:11:57 UTC -- Deleting old backups ... [SKIPPED]\n    2025-01-13 20:11:57 UTC -- Deleting tar staging files ...\n    2025-01-13 20:11:57 UTC -- Cleaning up /var/opt/gitlab/backups/backup_information.yml\n    2025-01-13 20:11:57 UTC -- Cleaning up /var/opt/gitlab/backups/db\n    2025-01-13 20:11:57 UTC -- Cleaning up /var/opt/gitlab/backups/repositories\n    2025-01-13 20:11:57 UTC -- Cleaning up /var/opt/gitlab/backups/uploads.tar.gz\n    2025-01-13 20:11:57 UTC -- Cleaning up /var/opt/gitlab/backups/builds.tar.gz\n    2025-01-13 20:11:57 UTC -- Cleaning up /var/opt/gitlab/backups/artifacts.tar.gz\n    2025-01-13 20:11:57 UTC -- Cleaning up /var/opt/gitlab/backups/pages.tar.gz\n    2025-01-13 20:11:57 UTC -- Cleaning up /var/opt/gitlab/backups/lfs.tar.gz\n    2025-01-13 20:11:57 UTC -- Cleaning up /var/opt/gitlab/backups/terraform_state.tar.gz\n    2025-01-13 20:11:57 UTC -- Cleaning up /var/opt/gitlab/backups/packages.tar.gz\n    2025-01-13 20:11:57 UTC -- Cleaning up /var/opt/gitlab/backups/ci_secure_files.tar.gz\n    2025-01-13 20:11:57 UTC -- Cleaning up /var/opt/gitlab/backups/external_diffs.tar.gz\n    2025-01-13 20:11:57 UTC -- Deleting tar staging files ... done\n    2025-01-13 20:11:57 UTC -- Deleting backups/tmp ...\n    2025-01-13 20:11:57 UTC -- Deleting backups/tmp ... done\n    2025-01-13 20:11:57 UTC -- Warning: Your gitlab.rb and gitlab-secrets.json files contain sensitive data\n    and are not included in this backup. You will need these files to restore a backup.\n    Please back them up manually.\n    2025-01-13 20:11:57 UTC -- Backup 1736799112_2025_01_13_17.7.1 is done.\n    2025-01-13 20:11:57 UTC -- Deleting backup and restore PID file at [/opt/gitlab/embedded/service/gitlab-rails/tmp/backup_restore.pid] ... done""]"
